{
  "complete": true,
  "content_fingerprint": "b33712c5a8d430f37fef3f7a1e84b99aa788b0178f1e346c63bd38da47889af1",
  "errors": [],
  "read_only": true,
  "records": [
    {
      "authority_classification": "supported_vector_projection_surface",
      "byte_count": 0,
      "details": {
        "access_status": "not_configured",
        "deployment_status": "not_configured",
        "report_checksums": [],
        "required_scanner": "declaration",
        "source_manifest_count": 0,
        "visibility": "public"
      },
      "duplicate_id_count": 0,
      "inventory_id": "inv_9b55dbaebb1c76bd975971e0",
      "locator": "authority:chromadb-capability",
      "locator_kind": "filesystem_authority",
      "max_event_time": null,
      "min_event_time": null,
      "parse_failure_count": 0,
      "planned_deletion_pr": "PR-10L",
      "proposed_future_importer": "PR-09A vector projection rebuild",
      "provenance_classification": "projection_only",
      "reader_symbols": [],
      "record_count": 0,
      "record_kind": "consolidated_authority",
      "recoverability_status": "not_configured",
      "source_label": "chromadb-capability",
      "stable_hash": "65cf2ada9e710f955994c1732927d9bb743a4f42aeb36ef85a79cec67ab518f8",
      "tenant_workspace_classification": "all-workspaces-static",
      "writer_symbols": []
    },
    {
      "authority_classification": "legacy_filesystem_authority",
      "byte_count": 408912,
      "details": {
        "access_status": "accessible_read_only",
        "deployment_status": "active",
        "report_checksums": [
          "3272c26e825549ea485a0a09135b9706ca5b68a4174cdae97a14c2ef16c4673f"
        ],
        "required_scanner": "filesystem",
        "source_manifest_count": 1,
        "visibility": "private"
      },
      "duplicate_id_count": 0,
      "inventory_id": "inv_e9ac30b0fc26589fb12ee1eb",
      "locator": "authority:local-primary-beads",
      "locator_kind": "filesystem_authority",
      "max_event_time": "2026-07-24T13:49:31.772643Z",
      "min_event_time": "2026-06-05T15:13:13.858079Z",
      "parse_failure_count": 0,
      "planned_deletion_pr": "PR-10H",
      "proposed_future_importer": "PR-10A through PR-10C filesystem transforms",
      "provenance_classification": "unknown",
      "reader_symbols": [],
      "record_count": 327,
      "record_kind": "consolidated_authority",
      "recoverability_status": "accessible_read_only",
      "source_label": "local-primary-beads",
      "stable_hash": "3ed27dbe39429184720919182a75f592665b5669d7a12056f4f06f1a8f960e38",
      "tenant_workspace_classification": "local-primary",
      "writer_symbols": []
    },
    {
      "authority_classification": "observed_event_store",
      "byte_count": 55662,
      "details": {
        "access_status": "accessible_read_only",
        "deployment_status": "active",
        "report_checksums": [
          "06f493c7e5fabe1bec8c5c747f8f9f604f6eaa77fa2940216e842f0c5f527f1d"
        ],
        "required_scanner": "filesystem",
        "source_manifest_count": 1,
        "visibility": "private"
      },
      "duplicate_id_count": 0,
      "inventory_id": "inv_6c5beab0c075878d56e29f22",
      "locator": "authority:local-primary-turns",
      "locator_kind": "filesystem_authority",
      "max_event_time": null,
      "min_event_time": null,
      "parse_failure_count": 0,
      "planned_deletion_pr": "PR-10H",
      "proposed_future_importer": "PR-10A SourceEvent transforms",
      "provenance_classification": "observed_source",
      "reader_symbols": [],
      "record_count": 18,
      "record_kind": "consolidated_authority",
      "recoverability_status": "accessible_read_only",
      "source_label": "local-primary-turns",
      "stable_hash": "8056bf0a4342c47c6ca1f02590640132ffc593a4f1d377bfcf8d53ca01755b48",
      "tenant_workspace_classification": "local-primary",
      "writer_symbols": []
    },
    {
      "authority_classification": "legacy_tenant_filesystem_authority",
      "byte_count": 0,
      "details": {
        "access_status": "accessible_read_only",
        "deployment_status": "active",
        "report_checksums": [
          "e676dc8bb0aebc40a25dfe03874d1c1ec61c3af3c23fe95f7b031f7c2e1771aa"
        ],
        "required_scanner": "filesystem",
        "source_manifest_count": 1,
        "visibility": "private"
      },
      "duplicate_id_count": 0,
      "inventory_id": "inv_7ad7a9b6efe1cdaee0e515b0",
      "locator": "authority:local-tenant-01",
      "locator_kind": "filesystem_authority",
      "max_event_time": null,
      "min_event_time": null,
      "parse_failure_count": 0,
      "planned_deletion_pr": "PR-10H",
      "proposed_future_importer": "PR-10A through PR-10C tenant transforms",
      "provenance_classification": "unknown",
      "reader_symbols": [],
      "record_count": 0,
      "record_kind": "consolidated_authority",
      "recoverability_status": "accessible_read_only",
      "source_label": "local-tenant-01",
      "stable_hash": "7d252a9d43d8d601ffecaa6e9911d068f8f92b57940f945aca6c1c18adf94043",
      "tenant_workspace_classification": "local-tenant-01",
      "writer_symbols": []
    },
    {
      "authority_classification": "legacy_tenant_filesystem_authority",
      "byte_count": 2346898,
      "details": {
        "access_status": "accessible_read_only",
        "deployment_status": "active",
        "report_checksums": [
          "144d90c10394a56e05fd1c1c7c0a6c09d12b985b14b9c0fdb603ffc36826205c"
        ],
        "required_scanner": "filesystem",
        "source_manifest_count": 1,
        "visibility": "private"
      },
      "duplicate_id_count": 0,
      "inventory_id": "inv_7a220b9ca4acb79990d8d589",
      "locator": "authority:local-tenant-02",
      "locator_kind": "filesystem_authority",
      "max_event_time": "2026-06-18T22:05:29.053714Z",
      "min_event_time": "2026-06-07T20:43:08.174284Z",
      "parse_failure_count": 0,
      "planned_deletion_pr": "PR-10H",
      "proposed_future_importer": "PR-10A through PR-10C tenant transforms",
      "provenance_classification": "unknown",
      "reader_symbols": [],
      "record_count": 218,
      "record_kind": "consolidated_authority",
      "recoverability_status": "accessible_read_only",
      "source_label": "local-tenant-02",
      "stable_hash": "a233ee9b2ae18f8403b848e6e09510577e43839d5e93794b6b9bf27a05dc6d1a",
      "tenant_workspace_classification": "local-tenant-02",
      "writer_symbols": []
    },
    {
      "authority_classification": "legacy_tenant_filesystem_authority",
      "byte_count": 0,
      "details": {
        "access_status": "accessible_read_only",
        "deployment_status": "active",
        "report_checksums": [
          "7b7f4990f74eb80e3dbb9b5b12aa418951a55af5aedc1470f66a82ee90a887a6"
        ],
        "required_scanner": "filesystem",
        "source_manifest_count": 1,
        "visibility": "private"
      },
      "duplicate_id_count": 0,
      "inventory_id": "inv_008be516425b42d636ac94cc",
      "locator": "authority:local-tenant-03",
      "locator_kind": "filesystem_authority",
      "max_event_time": null,
      "min_event_time": null,
      "parse_failure_count": 0,
      "planned_deletion_pr": "PR-10H",
      "proposed_future_importer": "PR-10A through PR-10C tenant transforms",
      "provenance_classification": "unknown",
      "reader_symbols": [],
      "record_count": 0,
      "record_kind": "consolidated_authority",
      "recoverability_status": "accessible_read_only",
      "source_label": "local-tenant-03",
      "stable_hash": "43f97731ae098293f23f7c30ff2e4148eda003c9d37f2df0de95a6db9aa94874",
      "tenant_workspace_classification": "local-tenant-03",
      "writer_symbols": []
    },
    {
      "authority_classification": "legacy_filesystem_authority",
      "byte_count": 448166,
      "details": {
        "access_status": "accessible_read_only",
        "deployment_status": "active",
        "report_checksums": [
          "f4e1fe18f42b6b209d7654ab8c893210d86d4b9b8159019c318ddac043a94fdd"
        ],
        "required_scanner": "filesystem",
        "source_manifest_count": 1,
        "visibility": "private"
      },
      "duplicate_id_count": 0,
      "inventory_id": "inv_3640fdfece0732ab046cda5a",
      "locator": "authority:local-user-default-store",
      "locator_kind": "filesystem_authority",
      "max_event_time": "2026-07-09T15:34:07.681949Z",
      "min_event_time": "2026-05-22T21:15:23.043090Z",
      "parse_failure_count": 0,
      "planned_deletion_pr": "PR-10H",
      "proposed_future_importer": "PR-10A through PR-10C filesystem transforms",
      "provenance_classification": "unknown",
      "reader_symbols": [],
      "record_count": 277,
      "record_kind": "consolidated_authority",
      "recoverability_status": "accessible_read_only",
      "source_label": "local-user-default-store",
      "stable_hash": "8bf9abd78a928872831d48eb03e21811aa3b99b6515fddb85d4c79d01bb1acf3",
      "tenant_workspace_classification": "local-default",
      "writer_symbols": []
    },
    {
      "authority_classification": "supported_graph_projection_surface",
      "byte_count": 0,
      "details": {
        "access_status": "not_configured",
        "deployment_status": "not_configured",
        "report_checksums": [],
        "required_scanner": "declaration",
        "source_manifest_count": 0,
        "visibility": "public"
      },
      "duplicate_id_count": 0,
      "inventory_id": "inv_96cc15d6d9876fc37b4cc401",
      "locator": "authority:neo4j-graphiti-capability",
      "locator_kind": "hosted_authority",
      "max_event_time": null,
      "min_event_time": null,
      "parse_failure_count": 0,
      "planned_deletion_pr": "PR-10J",
      "proposed_future_importer": "PR-09B graph projection rebuild",
      "provenance_classification": "projection_only",
      "reader_symbols": [],
      "record_count": 0,
      "record_kind": "consolidated_authority",